{
  "id": "251214_apexlegends_gtx1060-6g_r5-5600",
  "game": {
    "ja": "エーペックスレジェンズ",
    "en": "Apex Legends"
  },
  "testedAt": "2025-12-14",
  "summary": {
    "ja": "1080p  |  低 · 高",
    "en": "1080p  |  Low · High"
  },
  "version": {
    "ja": "",
    "en": ""
  },
  "season": {
    "ja": "シーズン27",
    "en": "Season 27"
  },
  "system": {
    "cpu": "AMD Ryzen 5 5600",
    "cpuShortName": "Ryzen 5 5600",
    "gpu": "NVIDIA GeForce GTX 1060 6GB",
    "graphicsCardName": "MSI GeForce GTX 1060 6G OC",
    "gpuShortName": "GTX 1060 6GB",
    "gpuDriver": "581.80",
    "motherboard": "MSI B550M PRO-VDH WIFI",
    "memory": {
      "frequency": "DDR4-3200",
      "capacity": "32.0 GB"
    },
    "os": "Windows 11 Pro 25H2"
  },
  "method": {
    "ja": "バトルロイヤルをプレイして計測",
    "en": "Played Battle Royale"
  },
  "videoUrl": "https://youtu.be/LG9krFR3oZ4",
  "display": {
    "showUpscaling": false,
    "showGraphicsApi": false,
    "graphicsApiLabel": ""
  },
  "results": [
    {
      "resolutionX": 1920,
      "resolutionY": 1080,
      "preset": {
        "ja": "低",
        "en": "Low"
      },
      "upscalingType": "",
      "upscalingQuality": "",
      "graphicsApi": "",
      "averageFps": 179,
      "onePercentLowFps": 98
    },
    {
      "resolutionX": 1920,
      "resolutionY": 1080,
      "preset": {
        "ja": "高",
        "en": "High"
      },
      "upscalingType": "",
      "upscalingQuality": "",
      "graphicsApi": "",
      "averageFps": 95,
      "onePercentLowFps": 59
    }
  ],
  "notes": {
    "ja": "",
    "en": ""
  }
}
