{
  "id": "250818_valorant_gtx680_i7-3770",
  "game": {
    "ja": "VALORANT",
    "en": "VALORANT"
  },
  "testedAt": "2025-08-18",
  "summary": {
    "ja": "1080p  |  低 · 高",
    "en": "1080p  |  Low · High"
  },
  "version": {
    "ja": "Patch 11.02",
    "en": "Patch 11.02"
  },
  "season": {
    "ja": "Season 2025 Act 4",
    "en": "Season 2025 Act 4"
  },
  "system": {
    "cpu": "Intel Core i7-3770",
    "cpuShortName": "Core i7-3770",
    "gpu": "NVIDIA GeForce GTX 680",
    "graphicsCardName": "MSI N680GTX Twin Frozr III OC",
    "gpuShortName": "GTX 680",
    "gpuDriver": "475.14",
    "motherboard": "Pegatron IMPSB-H61",
    "memory": {
      "frequency": "DDR3L-1600",
      "capacity": "16.0 GB"
    },
    "os": "Windows 10 Home 22H2"
  },
  "method": {
    "ja": "スイフトプレイをプレイして計測",
    "en": "Played Swiftplay"
  },
  "videoUrl": "https://youtu.be/InxhyXazOcs",
  "display": {
    "showUpscaling": false,
    "showGraphicsApi": false,
    "graphicsApiLabel": ""
  },
  "results": [
    {
      "resolutionX": 1920,
      "resolutionY": 1080,
      "preset": {
        "ja": "低",
        "en": "Low"
      },
      "upscalingType": "",
      "upscalingQuality": "",
      "graphicsApi": "",
      "averageFps": 153,
      "onePercentLowFps": 58
    },
    {
      "resolutionX": 1920,
      "resolutionY": 1080,
      "preset": {
        "ja": "高",
        "en": "High"
      },
      "upscalingType": "",
      "upscalingQuality": "",
      "graphicsApi": "",
      "averageFps": 140,
      "onePercentLowFps": 45
    }
  ],
  "notes": {
    "ja": "",
    "en": ""
  }
}
