{
  "id": "240622_valorant_gtx960m_i5-6300hq",
  "game": {
    "ja": "VALORANT",
    "en": "VALORANT"
  },
  "testedAt": "2024-06-22",
  "summary": {
    "ja": "720p · 900p · 1080p  |  低",
    "en": "720p · 900p · 1080p  |  Low"
  },
  "version": {
    "ja": "Patch 8.11",
    "en": "Patch 8.11"
  },
  "season": {
    "ja": "Episode 8 Act 3",
    "en": "Episode 8 Act 3"
  },
  "system": {
    "pcModel": "Dell Inspiron 15 7559",
    "cpu": "Intel Core i5-6300HQ",
    "cpuShortName": "Core i5-6300HQ",
    "gpu": "NVIDIA GeForce GTX 960M",
    "graphicsCardName": "",
    "gpuShortName": "GTX 960M",
    "gpuDriver": "552.22",
    "motherboard": "",
    "memory": {
      "frequency": "DDR3L-1600",
      "capacity": "16.0 GB"
    },
    "os": "Windows 10 Home 22H2"
  },
  "method": {
    "ja": "スイフトプレイをプレイして計測",
    "en": "Played Swiftplay"
  },
  "videoUrl": "https://youtu.be/MotJvnTzceM",
  "display": {
    "showUpscaling": false,
    "showGraphicsApi": false,
    "graphicsApiLabel": ""
  },
  "results": [
    {
      "resolutionX": 1280,
      "resolutionY": 720,
      "preset": {
        "ja": "低",
        "en": "Low"
      },
      "upscalingType": "",
      "upscalingQuality": "",
      "graphicsApi": "",
      "averageFps": 136,
      "onePercentLowFps": 60
    },
    {
      "resolutionX": 1600,
      "resolutionY": 900,
      "preset": {
        "ja": "低",
        "en": "Low"
      },
      "upscalingType": "",
      "upscalingQuality": "",
      "graphicsApi": "",
      "averageFps": 133,
      "onePercentLowFps": 59
    },
    {
      "resolutionX": 1920,
      "resolutionY": 1080,
      "preset": {
        "ja": "低",
        "en": "Low"
      },
      "upscalingType": "",
      "upscalingQuality": "",
      "graphicsApi": "",
      "averageFps": 109,
      "onePercentLowFps": 49
    }
  ],
  "notes": {
    "ja": "",
    "en": ""
  }
}
