{
  "id": "260902_fortnite_arc-140v_u7-258v",
  "game": {
    "ja": "フォートナイト",
    "en": "Fortnite"
  },
  "testedAt": "2026-09-02",
  "summary": {
    "ja": "1200p  |  低 · 中 · 高",
    "en": "1200p  |  Low · Medium · High"
  },
  "version": {
    "ja": "v42.00",
    "en": "v42.00"
  },
  "season": {
    "ja": "チャプター7 シーズン4",
    "en": "Chapter 7 Season 4"
  },
  "system": {
    "pcModel": "Fujitsu FMV WU1-K1 FMVUH06001",
    "cpu": "Intel Core Ultra 7 258V",
    "cpuShortName": "Core Ultra 7 258V",
    "gpu": "Intel Arc 140V",
    "graphicsCardName": "",
    "gpuShortName": "Arc 140V",
    "gpuDriver": "32.0.101.8991",
    "motherboard": "",
    "memory": {
      "frequency": "LPDDR5X-8533",
      "capacity": "32.0 GB"
    },
    "os": "Windows 11 Home 25H2"
  },
  "method": {
    "ja": "バトルロイヤルをプレイして計測",
    "en": "Played Battle Royale"
  },
  "videoUrl": "https://youtu.be/N_JppRWPxh8",
  "display": {
    "showUpscaling": true,
    "showGraphicsApi": true,
    "graphicsApiLabel": "Rendering mode"
  },
  "results": [
    {
      "resolutionX": 1920,
      "resolutionY": 1200,
      "preset": {
        "ja": "低",
        "en": "Low"
      },
      "upscalingType": "",
      "upscalingQuality": "",
      "graphicsApi": "Performance",
      "averageFps": 65,
      "onePercentLowFps": 33
    },
    {
      "resolutionX": 1920,
      "resolutionY": 1200,
      "preset": {
        "ja": "低",
        "en": "Low"
      },
      "upscalingType": "Intel XeSS",
      "upscalingQuality": "Quality",
      "graphicsApi": "DirectX 12",
      "averageFps": 41,
      "onePercentLowFps": 7
    },
    {
      "resolutionX": 1920,
      "resolutionY": 1200,
      "preset": {
        "ja": "中",
        "en": "Medium"
      },
      "upscalingType": "Intel XeSS",
      "upscalingQuality": "Quality",
      "graphicsApi": "DirectX 12",
      "averageFps": 34,
      "onePercentLowFps": 19
    },
    {
      "resolutionX": 1920,
      "resolutionY": 1200,
      "preset": {
        "ja": "高",
        "en": "High"
      },
      "upscalingType": "Intel XeSS",
      "upscalingQuality": "Quality",
      "graphicsApi": "DirectX 12",
      "averageFps": 26,
      "onePercentLowFps": 15
    }
  ],
  "notes": {
    "ja": "",
    "en": ""
  }
}
