{
  "id": "250927_nfsmw2012_rx6600_r5-5600",
  "game": {
    "ja": "Need for Speed: Most Wanted (2012)",
    "en": "Need for Speed: Most Wanted (2012)"
  },
  "testedAt": "2025-09-27",
  "summary": {
    "ja": "1440p · 4K  |  高",
    "en": "1440p · 4K  |  High"
  },
  "version": {
    "ja": "",
    "en": ""
  },
  "season": {
    "ja": "",
    "en": ""
  },
  "system": {
    "cpu": "AMD Ryzen 5 5600",
    "cpuShortName": "Ryzen 5 5600",
    "gpu": "AMD Radeon RX 6600",
    "graphicsCardName": "MSI Radeon RX 6600 MECH 2X 8G",
    "gpuShortName": "RX 6600",
    "gpuDriver": "25.9.1",
    "motherboard": "MSI B550M PRO-VDH WIFI",
    "memory": {
      "frequency": "DDR4-3200",
      "capacity": "32.0 GB"
    },
    "os": "Windows 11 Pro 24H2"
  },
  "method": {
    "ja": "スプリントレースをプレイして計測",
    "en": "Played sprint races"
  },
  "videoUrl": "https://youtu.be/EiXWOULlxbE",
  "display": {
    "showUpscaling": false,
    "showGraphicsApi": false,
    "graphicsApiLabel": ""
  },
  "results": [
    {
      "resolutionX": 2560,
      "resolutionY": 1440,
      "preset": {
        "ja": "高",
        "en": "High"
      },
      "upscalingType": "",
      "upscalingQuality": "",
      "graphicsApi": "",
      "averageFps": 60,
      "onePercentLowFps": 54
    },
    {
      "resolutionX": 3840,
      "resolutionY": 2160,
      "preset": {
        "ja": "高",
        "en": "High"
      },
      "upscalingType": "",
      "upscalingQuality": "",
      "graphicsApi": "",
      "averageFps": 59,
      "onePercentLowFps": 50
    }
  ],
  "notes": {
    "ja": "",
    "en": ""
  }
}
