{
  "id": "260915_asphalt-legends_gtx980_i7-3770",
  "game": {
    "ja": "アスファルト:Legends",
    "en": "Asphalt Legends"
  },
  "testedAt": "2026-09-15",
  "summary": {
    "ja": "1080p  |  全設定",
    "en": "1080p  |  All Settings"
  },
  "version": {
    "ja": "v52.1.2a",
    "en": "v52.1.2a"
  },
  "season": {
    "ja": "Pixel Pursuit Season",
    "en": "Pixel Pursuit Season"
  },
  "system": {
    "cpu": "Intel Core i7-3770",
    "cpuShortName": "Core i7-3770",
    "gpu": "NVIDIA GeForce GTX 980",
    "graphicsCardName": "Palit GeForce GTX 980 JetStream",
    "gpuShortName": "GTX 980",
    "gpuDriver": "582.66",
    "motherboard": "Pegatron IMPSB-H61",
    "memory": {
      "frequency": "DDR3L-1600",
      "capacity": "16.0 GB"
    },
    "os": "Windows 10 Home 22H2"
  },
  "method": {
    "ja": "マルチプレイをプレイして計測",
    "en": "Played Multiplayer"
  },
  "videoUrl": "https://youtu.be/Dgkwnpgnd7s",
  "display": {
    "showUpscaling": false,
    "showGraphicsApi": false,
    "graphicsApiLabel": ""
  },
  "results": [
    {
      "resolutionX": 1920,
      "resolutionY": 1080,
      "preset": {
        "ja": "最低",
        "en": "Lowest"
      },
      "upscalingType": "",
      "upscalingQuality": "",
      "graphicsApi": "",
      "averageFps": 237,
      "onePercentLowFps": 141
    },
    {
      "resolutionX": 1920,
      "resolutionY": 1080,
      "preset": {
        "ja": "低",
        "en": "Low"
      },
      "upscalingType": "",
      "upscalingQuality": "",
      "graphicsApi": "",
      "averageFps": 197,
      "onePercentLowFps": 136
    },
    {
      "resolutionX": 1920,
      "resolutionY": 1080,
      "preset": {
        "ja": "中",
        "en": "Medium"
      },
      "upscalingType": "",
      "upscalingQuality": "",
      "graphicsApi": "",
      "averageFps": 136,
      "onePercentLowFps": 96
    },
    {
      "resolutionX": 1920,
      "resolutionY": 1080,
      "preset": {
        "ja": "高",
        "en": "High"
      },
      "upscalingType": "",
      "upscalingQuality": "",
      "graphicsApi": "",
      "averageFps": 82,
      "onePercentLowFps": 61
    },
    {
      "resolutionX": 1920,
      "resolutionY": 1080,
      "preset": {
        "ja": "ウルトラ",
        "en": "Ultra"
      },
      "upscalingType": "",
      "upscalingQuality": "",
      "graphicsApi": "",
      "averageFps": 85,
      "onePercentLowFps": 53
    }
  ],
  "notes": {
    "ja": "",
    "en": ""
  }
}
