{
  "id": "241225_zzz_rx6600_r5-5600",
  "game": {
    "ja": "ゼンレスゾーンゼロ",
    "en": "Zenless Zone Zero"
  },
  "testedAt": "2024-12-25",
  "summary": {
    "ja": "1080p · 1440p · 4K  |  高",
    "en": "1080p · 1440p · 4K  |  High"
  },
  "version": {
    "ja": "Ver.1.4",
    "en": "Ver.1.4"
  },
  "season": {
    "ja": "",
    "en": ""
  },
  "system": {
    "cpu": "AMD Ryzen 5 5600",
    "cpuShortName": "Ryzen 5 5600",
    "gpu": "AMD Radeon RX 6600",
    "graphicsCardName": "MSI Radeon RX 6600 MECH 2X 8G",
    "gpuShortName": "RX 6600",
    "gpuDriver": "24.12.1",
    "motherboard": "MSI B550M PRO-VDH WIFI",
    "memory": {
      "frequency": "DDR4-3200",
      "capacity": "32.0 GB"
    },
    "os": "Windows 11 Pro 24H2"
  },
  "method": {
    "ja": "",
    "en": ""
  },
  "videoUrl": "https://youtu.be/QybCz_NmlXI",
  "display": {
    "showUpscaling": false,
    "showGraphicsApi": false,
    "graphicsApiLabel": ""
  },
  "results": [
    {
      "resolutionX": 1920,
      "resolutionY": 1080,
      "preset": {
        "ja": "高",
        "en": "High"
      },
      "upscalingType": "",
      "upscalingQuality": "",
      "graphicsApi": "",
      "averageFps": 111,
      "onePercentLowFps": 42
    },
    {
      "resolutionX": 2560,
      "resolutionY": 1440,
      "preset": {
        "ja": "高",
        "en": "High"
      },
      "upscalingType": "",
      "upscalingQuality": "",
      "graphicsApi": "",
      "averageFps": 74,
      "onePercentLowFps": 35
    },
    {
      "resolutionX": 3840,
      "resolutionY": 2160,
      "preset": {
        "ja": "高",
        "en": "High"
      },
      "upscalingType": "",
      "upscalingQuality": "",
      "graphicsApi": "",
      "averageFps": 35,
      "onePercentLowFps": 19
    }
  ],
  "notes": {
    "ja": "",
    "en": ""
  }
}
